{
  "type": "Humanoïde",
  "languages": [
    {
      "type": "fix",
      "value": "Commun"
    },
    {
      "type": "fix",
      "value": "Primordial"
    }
  ],
  "size": ["S", "M"],
  "features": [
    {
      "name": "Vision dans le noir",
      "level": 1,
      "description": "Vous pouvez voir dans une lumière faible à 60 ft. comme si vous étiez dans une lumière vive, et dans l'obscurité comme si vous étiez dans une lumière faible. Vous ne discernez pas les couleurs dans une telle obscurité.",
      "darkvision": 60
    }
  ],
  "subraces": [
    {
      "name": "Genasi d'Air",
      "speed": {
        "walk": 30
      },
      "ability_improvements": "CON +2, DEX +1",
      "features": [
        {
          "name": "Souffle sans Fin",
          "level": 1,
          "description": "Vous pouvez retenir votre respiration indéfiniment tant que vous n'êtes pas incapacité."
        },
        {
          "name": "Résistance à la Foudre",
          "level": 1,
          "description": "Vous avez la résistance aux dégâts de foudre.",
          "resistances": [
            {
              "type": "fix",
              "value": "foudre"
            }
          ]
        },
        {
          "name": "Danse du Vent",
          "level": 1,
          "description": "Vous connaissez le cantrip poigne électrique. À partir du niveau 3, vous pouvez lancer le sort feuille morte avec ce trait, sans devoir payer de composantes matérielles. À partir du niveau 5, vous pouvez également lancer le sort lévitation de cette manière. Une fois que vous avez lancé feuille morte ou lévitation avec ce trait, vous ne pouvez pas le relancer tant que vous n'avez pas fini un repos long. Vous pouvez également les lancer en utilisant des emplacements de sort.\n\nL'Intelligence, la Sagesse ou le Charisme est votre caractéristique d'incantation pour ces sorts lorsque vous les lancez avec ce trait (choisi à la sélection de cette race).",
          "spells": {
            "spellcasting": {
              "type": "choice",
              "values": [
                "Intelligence",
                "Sagesse",
                "Charisme"
              ]
            },
            "0": [
              {
                "name": "poigne électrique"
              }
            ],
            "1": [
              {
                "name": "feuille morte",
                "atlevel": 3
              }
            ],
            "2": [
              {
                "name": "lévitation",
                "atlevel": 5
              }
            ]
          },
          "trackers": [
            {
              "type": "fix",
              "name": "Danse du Vent -- Feuille Morte",
              "count": 1,
              "reset": "LR"
            },
            {
              "type": "fix",
              "name": "Danse du Vent -- Lévitation",
              "count": 1,
              "reset": "LR"
            }
          ]
        }
      ]
    },
    {
      "name": "Genasi de Terre",
      "speed": {
        "walk": 30
      },
      "ability_improvements": "CON +2, FOR +1",
      "features": [
        {
          "name": "Marche Terrestre",
          "level": 1,
          "description": "Vous pouvez vous déplacer sur du terrain difficile sans dépenser de mouvement supplémentaire si vous utilisez votre vitesse de marche sur le sol."
        },
        {
          "name": "Fusion avec la Pierre",
          "level": 1,
          "description": "Vous connaissez le cantrip protection contre les armes. Vous pouvez le lancer normalement, ou en utilisant une action bonus, un nombre de fois égal à votre bonus de maîtrise par repos long.\n\nÀ partir du niveau 3, vous pouvez également lancer le sort passage sans trace de cette manière. Une fois que vous avez lancé le sort avec ce trait, vous ne pouvez pas le relancer tant que vous n'avez pas fini un repos long. Vous pouvez également le lancer en utilisant des emplacements de sort.\n\nL'Intelligence, la Sagesse ou le Charisme est votre caractéristique d'incantation pour ces sorts lorsque vous les lancez avec ce trait (choisi à la sélection de cette race).",
          "spells": {
            "spellcasting": {
              "type": "choice",
              "values": ["Intelligence", "Sagesse", "Charisme"]
            },
            "0": [
              {
                "name": "protection contre les armes"
              }
            ],
            "2": [
              {
                "name": "passage sans trace",
                "atlevel": 3
              }
            ]
          },
        "trackers": [
          {
            "name": "Fusion avec la Pierre - Protection contre les Armes",
            "type": "stat.mod",
            "count": "PB",
            "reset": "LR"
          },
          {
            "name": "Fusion avec la Pierre - Passage sans trace",
            "type": "fix",
            "count": 1,
            "reset": "LR"
          }
        ]
        }
      ]
    },
    {
      "name": "Genasi de Feu",
      "ability_improvements": "CON +2, INT +1",
      "speed": {
        "walk": 30
      },
      "features": [
        {
          "name": "Résistance au Feu",
          "level": 1,
          "description": "Vous avez la résistance aux dégâts de feu.",
          "resistances": [
            {
              "type": "fix",
              "value": "feu"
            }
          ]
        },
        {
          "name": "Embrasement",
          "level": 1,
          "description": "Vous connaissez le cantrip flammes. À partir du niveau 3, vous pouvez lancer le sort mains brûlantes avec ce trait, sans devoir payer de composantes matérielles. À partir du niveau 5, vous pouvez également lancer le sort lame de feu de cette manière. Une fois que vous avez lancé mains brûlantes ou lame de feu avec ce trait, vous ne pouvez pas le relancer tant que vous n'avez pas fini un repos long. Vous pouvez également les lancer en utilisant des emplacements de sort.\n\nL'Intelligence, la Sagesse ou le Charisme est votre caractéristique d'incantation pour ces sorts lorsque vous les lancez avec ce trait (choisi à la sélection de cette race).",
          "spells": {
            "spellcasting": {
              "type": "choice",
              "values": ["Intelligence", "Sagesse", "Charisme"]
            },
            "0": [
              {
                "name": "flammes"
              }
            ],
            "1": [
              {
                "name": "mains brûlantes",
                "atlevel": 3
              }
            ],
            "2": [
              {
                "name": "lame de feu",
                "atlevel": 5
              }
            ]
          },
          "trackers": [
            {
              "type": "fix",
              "name": "Embrasement -- Mains Brûlantes",
              "count": 1,
              "reset": "LR"
            },
            {
              "type": "fix",
              "name": "Embrasement -- Lame de Feu",
              "count": 1,
              "reset": "LR"
            }
          ]
        }
      ]
    },
    {
      "name": "Genasi d'Eau",
      "ability_improvements": "CON +2, SAG +1",
      "speed": {
        "walk": 30
      },
      "features": [
        {
          "name": "Résistance à l'Acide",
          "level": 1,
          "description": "Vous avez la résistance aux dégâts d'acide.",
          "resistances": [
            {
              "value": "acide",
              "type": "fix"
            }
          ]
        },
        {
          "name": "Amphibien",
          "level": 1,
          "description": "Vous pouvez respirer dans l'air et dans l'eau."
        },
        {
          "name": "Appel de la Vague",
          "level": 1,
          "description": "Vous connaissez le cantrip aspersion d'acide. À partir du niveau 3, vous pouvez lancer le sort création ou destruction d'eau avec ce trait, sans devoir payer de composantes matérielles. À partir du niveau 5, vous pouvez également lancer le sort marche sur l'eau de cette manière. Une fois que vous avez lancé création ou destruction d'eau ou marche sur l'eau avec ce trait, vous ne pouvez pas le relancer tant que vous n'avez pas fini un repos long. Vous pouvez également les lancer en utilisant des emplacements de sort.\n\nL'Intelligence, la Sagesse ou le Charisme est votre caractéristique d'incantation pour ces sorts lorsque vous les lancez avec ce trait (choisi à la sélection de cette race).",
          "spells": {
            "spellcasting": {
              "type": "choice",
              "values": ["Intelligence", "Sagesse", "Charisme"]
            },
            "0": [
              {
                "name": "aspersion d'acide"
              }
            ],
            "1": [
              {
                "name": "création ou destruction d'eau",
                "atlevel": 3
              }
            ],
            "2": [
              {
                "name": "marche sur l'eau",

                "atlevel": 5
              }
            ]
          },
          "trackers": [
            {
              "type": "fix",
              "name": "Appel de la Vague -- Création ou Destruction d'Eau",
              "count": 1,
              "reset": "LR"
            },
            {
              "type": "fix",
              "name": "Appel de la Vague -- Marche sur l'Eau",
              "count": 1,
              "reset": "LR"
            }
          ]

        }
      ]
    }
  ]
}