{
  "ability_improvements": "FOR +2, CHA +1",
  "type": "Humanoïde",
  "languages": [
    {
      "type": "fix",
      "value": "Commun"
    },
    {
      "type": "fix",
      "value": "Primordial"
    }
  ],
  "size": ["M"],
  "speed": {
    "walk": 30
  },
  "features": [
    {
      "name": "Magie Firbolg",
      "level": 1,
      "description": "Vous pouvez lancer les sort détection de la magie et déguisement avec ce trait. Lorsque vous utilisez cette version de déguisement, vous pouvez apparaître comme 3 ft. plus grand ou plus petit. Une fois que vous avez lancé n'importe lequel de ces sorts avec ce trait, vous ne pouvez pas relancer ce sort avec ce trait tant que vous n'avez pas fini un repos long. Vous pouvez également lancer ces sorts en utilisant des emplacements de sort classiques.\n\nL'Intelligence, la Sagesse ou le Charisme est la caractéristique d'incantation pour ces sorts (vous choisissez au moment où vous sélectionnez cette race).",
      "spells": {
        "spellcasting": {
          "type": "choice",
          "values": ["Intelligence", "Sagesse", "Charisme"]
        },
        "1": [
          {
            "name": "détection de la magie"
          },
          {
            "name": "déguisement"
          }
        ]
      },
      "trackers": [
        {
          "type": "fix",
          "name": "Magie Firbolg -- Détection de la Magie",
          "count": 1,
          "reset": "LR"
        },
        {
          "type": "fix",
          "name": "Magie Firbolg -- Déguisement",
          "count": 1,
          "reset": "LR"
        }
      ]
    },
    {
      "name": "Pas Caché",
      "level": 1,
      "description": "Pour une action visible, vous pouvez magiquement devenir [[invisible]] jusqu'à la fin de votre prochain tour, ou jusqu'à ce que vous attaquiez, réalisiez un jet de dégâts, ou forciez quelqu'un à réaliser un jet de sauvegarde. Vous pouvez utiliser ce trait un nombre de fois égal à votre bonus de maîtrise, et vous regagnez toutes les utilisations après un repos long.",
      "trackers": [
        {
          "name": "Pas Caché",
          "type": "stat.mod",
          "count": "PB",
          "reset": "LR"
        }
      ]
    },
    {
      "name": "Carrure Imposante",
      "level": 1,
      "description": "Vous êtes considéré comme d'une taille plus grande lorsque vous déterminez le poids que vous pouvez porter, tirer, soulever."
    },
    {
      "name": "Dialogue de la Bête et de la Feuille",
      "level": 1,
      "description": "Vous avez la capacité de communiquer légèrement avec les Bêtes, Plantes et la végétation. Ils peuvent comprendre le sens de vos mots, même si vous n'avez pas de disposition particulière à les comprendre en retour. Vous avez l'avantage à tous les jets de Charisme que vous réalisez pour les influencer."
    }
  ]
}